{
  "$schema": "http://json-schema.org/draft-07/schema#",
  "type": "object",
  "required": ["id", "is_really_true", "text", "plausibility", "harmfulness", "self_conceal_score"],
  "properties": {
    "id": {
      "type": "string",
      "description": "Unique identifier for the rumor"
    },
    "is_really_true": {
      "type": "boolean",
      "description": "Whether the rumor is actually true"
    },
    "text": {
      "type": "string",
      "description": "The content of the rumor"
    },
    "hash_text": {
      "type": "string",
      "description": "The content of the rumor in a more hashed form, LLM readable"
    },
    "plausibility": {
      "type": "number",
      "description": "How plausible the rumor seems",
      "minimum": 0,
      "maximum": 1000
    },
    "harmfulness": {
      "type": "number",
      "description": "How harmful the rumor is",
      "minimum": 0,
      "maximum": 1000
    },
    "self_conceal_score": {
      "type": "number",
      "description": "How well the rumor is concealed/hidden",
      "minimum": 0,
      "maximum": 1000
    }
  }
} 