{
  "id": "Nicholas1",
  "is_really_true": true,
  "text": "Nicholas recent sold a 'black' property - a house that the mafia extorted from an ex member. Nicholas asked no questions about the deal, he just knew it was shady and got a good payday.",
  "hash_text": "",
  "plausibility": 500,
  "harmfulness": 600,
  "self_conceal_score": 850
} 